{
  "repository_command_profile_version": 1,
  "profile_id": "overworld-ci-v1",
  "repository": "alethia-earth/Overworld",
  "image_marker": "overworld-ci-jit-v1",
  "runner_memory_bytes": 4294967296,
  "source_workflow_path": ".github/workflows/ci.yml",
  "source_workflow_sha256": "c91ef6e3c42f884c72ae9f6c982e575af0ce84b8a1dd9c17898d5b6859873d60",
  "dependency_snapshots": {
    "backend": {
      "lock_path": "backend/bun.lock",
      "lock_sha256": "5e99b30664687cf49dc142e65739c49f31213d9faa5477aeff37d4ab9bf795a8",
      "node_modules_path": "/opt/self-hosted-ci/overworld-deps/backend-node_modules"
    },
    "frontend": {
      "lock_path": "frontend/bun.lock",
      "lock_sha256": "2d7a3760004adf177c07963bfcef3ea21a6336d3cb25ab0caccec05fc87d4049",
      "node_modules_path": "/opt/self-hosted-ci/overworld-deps/frontend-node_modules"
    }
  },
  "runner_script": "repository_profiles/overworld/run-overworld-ci.sh",
  "runner_script_sha256": "f85991235a71b5e06f63812ef54d3cfaa9902328c0e660416be33e8f8209c906",
  "phases": ["backend", "frontend", "e2e"],
  "toolchain": {
    "bun": "1.4.0",
    "garm": "0.2.1",
    "minio": "RELEASE.2025-09-07T16-13-09Z",
    "node": "22.23.2",
    "playwright": "1.59.1",
    "postgresql_backend": "16",
    "postgis_backend": "3.4",
    "postgresql_e2e": "17",
    "postgis_e2e": "3.5",
    "python": "3.12",
    "uv": "0.8.22",
    "waterfall_revision": "a5834a2f7665f956297c03cc32e5601b097bffbe"
  }
}
